{
  "$schema": "https://json-schema.org/draft/2020-12/schema",
  "$id": "https://owasp.org/dsgai/datasets/exploit_dataset/schema.json",
  "title": "DSGAI Exploit Technique Entry",
  "description": "Schema for a single technique entry in the OWASP DSGAI exploit_dataset. Each entry documents a reusable, publicly disclosed attack technique against GenAI systems. One JSON file per entry, validated against this schema.",
  "type": "object",
  "additionalProperties": false,
  "required": [
    "exploit_id",
    "title",
    "description",
    "target_component",
    "dsgai_mapping",
    "severity",
    "source_urls",
    "date_added",
    "disclosure_status"
  ],
  "properties": {
    "$schema": {
      "description": "Optional pointer to the schema file for editor tooling. Ignored by validators.",
      "type": "string"
    },
    "exploit_id": {
      "description": "Internal identifier. Use AML.T#### for techniques that map 1:1 to an ATLAS entry, or 'DSGAI-EXP-<slug>' for technique families not in ATLAS.",
      "type": "string",
      "pattern": "^(AML\\.T[0-9]{4}(\\.[0-9]{3})?|DSGAI-EXP-[a-z0-9-]+)$"
    },
    "title": {
      "description": "Short human-readable name of the technique.",
      "type": "string",
      "minLength": 4,
      "maxLength": 200
    },
    "description": {
      "description": "What the technique does and why it works. 2-6 sentences.",
      "type": "string",
      "minLength": 40
    },
    "target_component": {
      "description": "Primary architectural component the technique targets.",
      "type": "string",
      "enum": [
        "model",
        "fine_tuned_adapter",
        "rag_pipeline",
        "vector_store",
        "embedding_model",
        "agent_framework",
        "plugin_or_tool",
        "inference_server",
        "api_or_sdk",
        "training_pipeline",
        "guardrail_or_filter",
        "browser_assistant",
        "ide_assistant",
        "observability_stack",
        "human_in_the_loop",
        "other"
      ]
    },
    "dsgai_mapping": {
      "description": "DSGAI risk entries this technique targets or maps to.",
      "type": "array",
      "items": {
        "type": "string",
        "enum": [
          "DSGAI01", "DSGAI02", "DSGAI03", "DSGAI04", "DSGAI05",
          "DSGAI06", "DSGAI07", "DSGAI08", "DSGAI09", "DSGAI10",
          "DSGAI11", "DSGAI12", "DSGAI13", "DSGAI14", "DSGAI15",
          "DSGAI16", "DSGAI17", "DSGAI18", "DSGAI19", "DSGAI20", "DSGAI21"
        ]
      },
      "minItems": 1,
      "uniqueItems": true
    },
    "mitre_atlas_mapping": {
      "description": "MITRE ATLAS technique or sub-technique IDs this entry aligns with (AML.T#### or AML.T####.###).",
      "type": "array",
      "items": {
        "type": "string",
        "pattern": "^AML\\.T[0-9]{4}(\\.[0-9]{3})?$"
      },
      "uniqueItems": true
    },
    "owasp_llm_top10_mapping": {
      "description": "OWASP Top 10 for LLM Applications 2025 entries this technique aligns with.",
      "type": "array",
      "items": {
        "type": "string",
        "enum": [
          "LLM01:2025", "LLM02:2025", "LLM03:2025", "LLM04:2025", "LLM05:2025",
          "LLM06:2025", "LLM07:2025", "LLM08:2025", "LLM09:2025", "LLM10:2025"
        ]
      },
      "uniqueItems": true
    },
    "attack_steps": {
      "description": "Ordered, high-level steps an attacker performs to execute the technique. 2-8 steps recommended; do not include working payloads or zero-day specifics.",
      "type": "array",
      "items": { "type": "string", "minLength": 8 },
      "minItems": 2
    },
    "prerequisites": {
      "description": "Required attacker capabilities, access level, or environmental conditions.",
      "type": "array",
      "items": { "type": "string", "minLength": 4 }
    },
    "impact": {
      "description": "Categories of consequence if the technique succeeds.",
      "type": "array",
      "items": {
        "type": "string",
        "enum": [
          "data_exfiltration",
          "credential_exposure",
          "privilege_escalation",
          "integrity_compromise",
          "availability_loss",
          "policy_bypass",
          "training_data_disclosure",
          "system_prompt_disclosure",
          "model_theft",
          "supply_chain_compromise",
          "financial_harm",
          "reputational_harm",
          "cross_tenant_disclosure",
          "other"
        ]
      },
      "minItems": 1,
      "uniqueItems": true
    },
    "detection_indicators": {
      "description": "Observable signs that the technique is being attempted or has succeeded.",
      "type": "array",
      "items": { "type": "string", "minLength": 4 }
    },
    "severity": {
      "description": "Severity if successfully executed against an unprotected target.",
      "type": "object",
      "additionalProperties": false,
      "required": ["qualitative"],
      "properties": {
        "qualitative": {
          "type": "string",
          "enum": ["Critical", "High", "Medium", "Low", "Informational"]
        }
      }
    },
    "source_urls": {
      "description": "Public, citable references — ATLAS, research papers, vendor advisories, conference talks, blog posts. At least one required.",
      "type": "array",
      "items": { "type": "string", "format": "uri" },
      "minItems": 1,
      "uniqueItems": true
    },
    "date_documented": {
      "description": "Date the technique was first publicly documented (ISO 8601 date).",
      "type": "string",
      "format": "date"
    },
    "date_added": {
      "description": "Date this entry was added to the dataset (ISO 8601 date).",
      "type": "string",
      "format": "date"
    },
    "disclosure_status": {
      "description": "How the technique was made public.",
      "type": "string",
      "enum": ["atlas_catalog", "research_publication", "vendor_advisory", "coordinated_disclosure", "conference_talk", "blog_post", "responsible_disclosure"]
    },
    "exploited_in_the_wild": {
      "description": "Whether the technique has been observed in real-world attacks.",
      "type": "string",
      "enum": ["yes", "suspected", "no", "unknown"]
    },
    "mitigations": {
      "description": "Recommended defensive measures specific to this technique.",
      "type": "array",
      "items": { "type": "string", "minLength": 4 }
    },
    "related_vulnerabilities": {
      "description": "vulnerability_dataset IDs (CVE-* or DSGAI-VULN-*) where this technique appeared in a real-world disclosure.",
      "type": "array",
      "items": {
        "type": "string",
        "pattern": "^(CVE-\\d{4}-\\d{4,7}|GHSA-[a-z0-9]{4}-[a-z0-9]{4}-[a-z0-9]{4}|DSGAI-VULN-[a-z0-9-]+)$"
      },
      "uniqueItems": true
    },
    "tags": {
      "description": "Free-form classification tags.",
      "type": "array",
      "items": { "type": "string", "minLength": 2 },
      "uniqueItems": true
    },
    "notes": {
      "description": "Author notes, scope caveats, model- or version-specific behavior.",
      "type": "string"
    }
  }
}
