{
  "$schema": "../schema.json",
  "exploit_id": "DSGAI-EXP-unicode-tag-smuggling",
  "title": "Unicode tag-character smuggling — invisible prompt injection",
  "description": "Riley Goodside and Johann Rehberger documented prompt-injection delivery via Unicode Tag characters (U+E0000–U+E007F), an obscure code block that LLMs read but most renderers and humans do not display. An attacker encodes the entire malicious instruction in tag characters and embeds it in otherwise-benign content (a comment, a document, a URL, a code block); the text appears normal to reviewers while the model receives the full payload. Particularly potent against code-assistant and IDE-integrated AI surfaces.",
  "target_component": "guardrail_or_filter",
  "dsgai_mapping": ["DSGAI21", "DSGAI09"],
  "mitre_atlas_mapping": ["AML.T0068", "AML.T0051.001"],
  "owasp_llm_top10_mapping": ["LLM01:2025"],
  "attack_steps": [
    "Encode the injection payload into Unicode Tag characters (one-to-one map from ASCII A-Z/a-z/0-9 to U+E0041 and friends).",
    "Embed the encoded payload in content the target LLM will ingest (commit message, doc, ticket, code comment).",
    "Human reviewers see a clean line; the LLM tokenizer reads the tag characters and the model acts on them.",
    "Pair with a target effect — exfiltration via markdown, tool invocation, persona switch."
  ],
  "prerequisites": [
    "Write access to a surface the LLM ingests.",
    "Knowledge that the target's input pipeline does not strip tag characters."
  ],
  "impact": [
    "policy_bypass",
    "data_exfiltration",
    "integrity_compromise"
  ],
  "detection_indicators": [
    "Bytes in the U+E0000–U+E007F range in any user- or content-channel input.",
    "Tokenized content where decoded characters do not match rendered characters.",
    "LLM responses that reference instructions not present in the visible prompt."
  ],
  "severity": {
    "qualitative": "High"
  },
  "source_urls": [
    "https://embracethered.com/blog/posts/2024/hiding-and-finding-text-with-unicode-tags/",
    "https://x.com/goodside/status/1745511940351287394"
  ],
  "date_documented": "2024-01-12",
  "date_added": "2026-05-18",
  "disclosure_status": "research_publication",
  "exploited_in_the_wild": "yes",
  "mitigations": [
    "Strip Unicode tag characters (U+E0000–U+E007F) and zero-width characters at every input boundary.",
    "Normalize input to NFKC and reject inputs whose normalized form differs from rendered form.",
    "Make input pipelines display tokenized content to reviewers when available."
  ],
  "related_vulnerabilities": [
    "DSGAI-VULN-2025-gitlab-duo-prompt-injection"
  ],
  "tags": ["obfuscation", "unicode-smuggling", "invisible-text", "prompt-injection"]
}
