{
  "$schema": "../schema.json",
  "exploit_id": "DSGAI-EXP-crescendo-multi-turn-jailbreak",
  "title": "Crescendo — multi-turn benign-to-disallowed ramp jailbreak",
  "description": "Russinovich et al. (Microsoft, arXiv 2404.01833) demonstrated the Crescendo attack: a sequence of prompts that begin benign, establish a topic and rapport, then incrementally cross policy boundaries one small step at a time. Each step is individually below the refusal threshold; the cumulative drift produces full-policy violation. Crescendo defeats turn-scoped safety classifiers because no single turn is sufficient evidence of intent.",
  "target_component": "guardrail_or_filter",
  "dsgai_mapping": ["DSGAI21", "DSGAI01"],
  "mitre_atlas_mapping": ["AML.T0054"],
  "owasp_llm_top10_mapping": ["LLM01:2025"],
  "attack_steps": [
    "Pick a target policy class and a benign on-topic opener.",
    "Each subsequent turn nudges incrementally closer to the disallowed content; reference prior turns to anchor the model.",
    "If a refusal occurs, back off one step and re-establish the trajectory.",
    "Converge to the prohibited request after the model has committed to the topic."
  ],
  "prerequisites": [
    "Multi-turn conversational access to the model."
  ],
  "impact": [
    "policy_bypass",
    "reputational_harm"
  ],
  "detection_indicators": [
    "Conversations that monotonically drift toward a single policy boundary over many turns.",
    "Per-turn refusal probabilities trending downward across a session.",
    "Repeated user references to prior commitments ('as you said earlier...')."
  ],
  "severity": {
    "qualitative": "High"
  },
  "source_urls": [
    "https://arxiv.org/abs/2404.01833"
  ],
  "date_documented": "2024-04-02",
  "date_added": "2026-05-18",
  "disclosure_status": "research_publication",
  "exploited_in_the_wild": "yes",
  "mitigations": [
    "Apply session-level safety scoring across the cumulative context, not just per-turn.",
    "Re-evaluate the model's full conversation trajectory before each potentially-disallowed generation.",
    "Reset stale context periodically; require explicit re-grounding for sensitive topics."
  ],
  "tags": ["jailbreak", "multi-turn", "session-drift", "policy-bypass"]
}
