{
  "$schema": "../schema.json",
  "exploit_id": "AML.T0043",
  "title": "Craft Adversarial Data",
  "description": "An adversary creates inputs that are modified to cause the target model's desired-by-attacker effect — misclassification, missed detection, evasion of safety policy. Modifications are typically constrained so a human still perceives the input as normal. Sub-techniques include White-Box Optimization (.000) using gradient access, Black-Box Optimization (.001) using query feedback, Black-Box Transfer (.002) using a substitute model, Manual Modification (.003), and Insert Backdoor Trigger (.004) which pairs with Poison Training Data.",
  "target_component": "model",
  "dsgai_mapping": ["DSGAI04", "DSGAI05"],
  "mitre_atlas_mapping": ["AML.T0043"],
  "owasp_llm_top10_mapping": ["LLM01:2025", "LLM04:2025"],
  "attack_steps": [
    "Choose attack class based on access: white-box gradient, black-box query, transfer, manual, or backdoor trigger.",
    "Optimize the perturbation against an objective function (misclassification, refusal-failure, target class).",
    "Constrain perturbation magnitude or location to remain human-imperceptible if that matters.",
    "Verify the attack works against the live target (AML.T0042) before deploying at scale."
  ],
  "prerequisites": [
    "Access matched to chosen sub-technique (weights, queries, or substitute model)."
  ],
  "impact": [
    "policy_bypass",
    "integrity_compromise"
  ],
  "detection_indicators": [
    "Inputs that classify confidently to a class far from the natural-image manifold (image domain).",
    "Adversarial-suffix-like nonsense token strings (LLM domain).",
    "Input-perturbation patterns inconsistent with natural noise distributions."
  ],
  "severity": {
    "qualitative": "High"
  },
  "source_urls": [
    "https://atlas.mitre.org/techniques/AML.T0043",
    "https://arxiv.org/abs/2307.15043"
  ],
  "date_documented": "2022-10-21",
  "date_added": "2026-05-18",
  "disclosure_status": "atlas_catalog",
  "exploited_in_the_wild": "yes",
  "mitigations": [
    "Adversarial training and input-distribution-shift detection.",
    "Defensive distillation, randomized smoothing, or certified-robustness training where applicable.",
    "Monitor for anomalous input patterns at the API boundary."
  ],
  "tags": ["adversarial-example", "evasion", "gcg", "foundational-technique"]
}
