{
  "$schema": "../schema.json",
  "exploit_id": "AML.T0051.000",
  "title": "Direct LLM Prompt Injection",
  "description": "An adversary submits malicious prompts directly to the LLM as a user of the system. The attacker may attempt to override the system prompt, escape from a constrained-task wrapper, or coerce the model into generating harmful or policy-violating content. Direct injection is the canonical starting point for jailbreaks, system-prompt extraction, and tool-abuse chains, and is what early DAN-family attacks targeted.",
  "target_component": "model",
  "dsgai_mapping": ["DSGAI15", "DSGAI06", "DSGAI21"],
  "mitre_atlas_mapping": ["AML.T0051.000"],
  "owasp_llm_top10_mapping": ["LLM01:2025"],
  "attack_steps": [
    "Probe the deployed assistant to discover what tools, refusal patterns, and rendering paths it exposes (AML.T0069, AML.T0062).",
    "Construct a prompt that overrides the operator's instructions — instruction override, roleplay, fictionalization, or constrained format trick.",
    "Submit the prompt directly; iterate based on refusals until the desired behavior is obtained (AML.T0065).",
    "Use the resulting access to extract data, invoke tools, or pivot to other techniques."
  ],
  "prerequisites": [
    "User-level access to the LLM interface or API."
  ],
  "impact": [
    "policy_bypass",
    "system_prompt_disclosure",
    "data_exfiltration",
    "integrity_compromise"
  ],
  "detection_indicators": [
    "User prompts containing high-rank injection patterns ('ignore', 'as a security researcher', delimiter manipulation).",
    "Mid-conversation refusal-rate collapse for the same user.",
    "Output containing system-prompt-like text or admin-style instructions."
  ],
  "severity": {
    "qualitative": "High"
  },
  "source_urls": [
    "https://atlas.mitre.org/techniques/AML.T0051.000"
  ],
  "date_documented": "2023-02-01",
  "date_added": "2026-05-18",
  "disclosure_status": "atlas_catalog",
  "exploited_in_the_wild": "yes",
  "mitigations": [
    "Apply instruction-hierarchy enforcement at the API layer; do not let user role override system role.",
    "Use post-generation safety classifiers in addition to input filters.",
    "Constrain tool surface; require explicit user-confirmed steps for any side-effecting action."
  ],
  "tags": ["prompt-injection", "direct-injection"]
}
