{
  "$schema": "../schema.json",
  "exploit_id": "DSGAI-EXP-many-shot-jailbreak",
  "title": "Many-shot jailbreaking — long-context refusal collapse",
  "description": "Anthropic disclosed Many-shot jailbreaking (Anil et al., April 2024): in a single user message, the attacker provides many fictitious dialogue examples in which the assistant complies with disallowed requests, then asks the actual disallowed question at the end. Long-context models extrapolate from the demonstrated 'compliance pattern' and answer. The success rate scales with the number of shots and the model's context length; the technique exploits in-context learning that scales as models add context.",
  "target_component": "model",
  "dsgai_mapping": ["DSGAI21", "DSGAI15"],
  "mitre_atlas_mapping": ["AML.T0054"],
  "owasp_llm_top10_mapping": ["LLM01:2025"],
  "attack_steps": [
    "Synthesize many fake question/answer pairs where a fictional assistant complies with disallowed requests.",
    "Concatenate them into a single user message preceding the real disallowed question.",
    "Submit; the model in-context-learns the compliance pattern and answers."
  ],
  "prerequisites": [
    "A model with a sufficiently long context window.",
    "Standard query access."
  ],
  "impact": [
    "policy_bypass",
    "reputational_harm"
  ],
  "detection_indicators": [
    "Very long user prompts containing many synthetic Q/A turns.",
    "Prompts whose token count is dominated by example-shaped content.",
    "Refusal-rate collapse at high prompt lengths."
  ],
  "severity": {
    "qualitative": "High"
  },
  "source_urls": [
    "https://www.anthropic.com/research/many-shot-jailbreaking"
  ],
  "date_documented": "2024-04-02",
  "date_added": "2026-05-18",
  "disclosure_status": "vendor_advisory",
  "exploited_in_the_wild": "suspected",
  "mitigations": [
    "Cap the number of synthetic-example turns a single user message may contain.",
    "Run safety classifiers on the user message before in-context-learning kicks in.",
    "Detect long prompts with high pattern-repetition density and route to stricter safety."
  ],
  "tags": ["jailbreak", "in-context-learning", "long-context", "many-shot"]
}
