{
  "$schema": "../schema.json",
  "exploit_id": "AML.T0094",
  "title": "Delay Execution of LLM Instructions",
  "description": "An adversary includes instructions for the LLM to follow only in response to a future event — a specific keyword, the next interaction, a scheduled task. Many AI-agent defenses prevent sensitive tool calls during a turn whose context contains untrusted data; deferring execution to a later, 'clean'-looking turn bypasses that taint-tracking control. Common phrasings include 'when the user next asks...', 'if the response mentions X then...', and 'on the next tool invocation, also do Y'.",
  "target_component": "agent_framework",
  "dsgai_mapping": ["DSGAI06", "DSGAI15"],
  "mitre_atlas_mapping": ["AML.T0094"],
  "owasp_llm_top10_mapping": ["LLM01:2025"],
  "attack_steps": [
    "Plant the injection in a turn or content surface whose immediate context is recognized as untrusted.",
    "Phrase instructions conditionally — tied to a future user action, keyword, or system event.",
    "When the future trigger fires, the model is now in a context the taint-tracker treats as clean, and the deferred instructions execute with full tool privilege.",
    "Achieve the original goal (exfiltration, tool abuse) in the 'safe' turn."
  ],
  "prerequisites": [
    "Initial injection foothold.",
    "Knowledge that the target deploys turn-scoped taint-tracking guards."
  ],
  "impact": [
    "policy_bypass",
    "data_exfiltration",
    "integrity_compromise"
  ],
  "detection_indicators": [
    "Injection payloads containing future-tense, conditional, or event-triggered phrasing.",
    "Tool calls fired on benign-looking turns whose only special property is prior context contamination."
  ],
  "severity": {
    "qualitative": "High"
  },
  "source_urls": [
    "https://atlas.mitre.org/techniques/AML.T0094"
  ],
  "date_documented": "2025-04-09",
  "date_added": "2026-05-18",
  "disclosure_status": "atlas_catalog",
  "exploited_in_the_wild": "suspected",
  "mitigations": [
    "Make taint persistent across turns — once a session has ingested untrusted content, treat the entire session as untrusted for sensitive tool calls.",
    "Detect conditional / future-tense phrasing in ingested content; flag as high-risk.",
    "Require explicit user confirmation for tool calls following any untrusted-content turn."
  ],
  "tags": ["deferred-execution", "taint-evasion", "agent-attack"]
}
