{
  "$schema": "../schema.json",
  "exploit_id": "AML.T0101",
  "title": "Data Destruction via AI Agent Tool Invocation",
  "description": "An adversary causes an AI agent to invoke a tool capable of mutative operations to delete or overwrite data — files, database records, calendar events, repository branches, CRM rows. The agent is the executing principal; the user often never sees the destructive call. Combined with prompt injection over agent-fetched content, an attacker who controls a single retrieved document can trigger mass deletion against the agent's connected systems.",
  "target_component": "plugin_or_tool",
  "dsgai_mapping": ["DSGAI06", "DSGAI17"],
  "mitre_atlas_mapping": ["AML.T0101"],
  "owasp_llm_top10_mapping": ["LLM05:2025"],
  "attack_steps": [
    "Identify agent tools with destructive verbs (delete, drop, truncate, force-push, hard-delete).",
    "Plant an injection (often indirect via fetched content) that instructs the agent to invoke the destructive tool.",
    "The agent calls the tool with attacker-supplied scope (which records, which paths).",
    "Backups, audit logs, or recovery surfaces also targeted in some variants to hinder restoration."
  ],
  "prerequisites": [
    "Agent has destructive-capable tools enabled.",
    "Injection or jailbreak foothold."
  ],
  "impact": [
    "availability_loss",
    "integrity_compromise",
    "financial_harm"
  ],
  "detection_indicators": [
    "Mass-delete or bulk-mutate tool calls following an injection-shaped turn.",
    "Tool calls whose scope (record counts, path globs) is unusually wide.",
    "Sudden audit-log deletions or recovery-system access by the agent."
  ],
  "severity": {
    "qualitative": "Critical"
  },
  "source_urls": [
    "https://atlas.mitre.org/techniques/AML.T0101"
  ],
  "date_documented": "2025-04-09",
  "date_added": "2026-05-18",
  "disclosure_status": "atlas_catalog",
  "exploited_in_the_wild": "suspected",
  "mitigations": [
    "Default-deny destructive tools; require explicit per-call user confirmation, never agent-autonomous.",
    "Apply quotas and scope caps on mutative tool calls (max N records per call).",
    "Keep backups out of any account the agent can reach; restore-path access stays manual."
  ],
  "tags": ["destructive-action", "agent-attack", "availability-attack"]
}
