{
  "$schema": "../schema.json",
  "exploit_id": "AML.T0056",
  "title": "Extract LLM System Prompt",
  "description": "An adversary induces the model to reveal its own system prompt — the operator-supplied directive that defines persona, scope, allowed tools, and refusal rules. Extraction is typically accomplished by prompt injection (asking the model to repeat, paraphrase, translate, or base64-encode its instructions) but the prompt can also be obtained from leaked config files or memory disclosures. The recovered prompt is competitive IP for the operator and a roadmap for the attacker, who can now craft prompts that hit the model's exact refusal blind spots.",
  "target_component": "model",
  "dsgai_mapping": ["DSGAI01", "DSGAI15"],
  "mitre_atlas_mapping": ["AML.T0056", "AML.T0069.002"],
  "owasp_llm_top10_mapping": ["LLM02:2025", "LLM07:2025"],
  "attack_steps": [
    "Probe the assistant for system-prompt boundary indicators (markers, role tokens, refusal phrasing).",
    "Issue requests that ask the model to repeat its instructions verbatim, translate them, render them in a different encoding, or include them in a generated artifact (poem, JSON, code comment).",
    "Iterate until the full system prompt surfaces in output.",
    "Use the extracted prompt to design follow-on injection payloads (AML.T0065) tailored to the operator's defenses."
  ],
  "prerequisites": [
    "Query access to the LLM."
  ],
  "impact": [
    "system_prompt_disclosure",
    "policy_bypass"
  ],
  "detection_indicators": [
    "User prompts asking for 'instructions', 'rules', 'persona', 'first message', or 'configuration'.",
    "Outputs containing role tokens, delimiters, or admin-style imperatives.",
    "Sudden output of long structured text immediately after a translate/encode request."
  ],
  "severity": {
    "qualitative": "Medium"
  },
  "source_urls": [
    "https://atlas.mitre.org/techniques/AML.T0056"
  ],
  "date_documented": "2024-05-09",
  "date_added": "2026-05-18",
  "disclosure_status": "atlas_catalog",
  "exploited_in_the_wild": "yes",
  "mitigations": [
    "Treat the system prompt as IP; assume it can be extracted and design defenses that do not rely on its secrecy.",
    "Filter outputs for content matching the system prompt before returning to the user.",
    "Detect translation-, encoding-, and verbatim-repetition probes against system-prompt content."
  ],
  "tags": ["system-prompt-extraction", "reconnaissance"]
}
