{
  "$schema": "../schema.json",
  "exploit_id": "DSGAI-EXP-visual-prompt-injection",
  "title": "Visual prompt injection — instructions embedded in images for VLMs",
  "description": "Vision-language models (GPT-4V, Claude with vision, Gemini, Llava) perform aggressive OCR on input images and treat the recovered text as part of the conversation. Adversarial instructions rendered as visible text in an image — even at small font size, low contrast, rotated, or blended into busy backgrounds — are read and obeyed. Text-only safety filters do not see the injection because no text was submitted; it entered as pixels. The technique generalized within weeks of GPT-4V's September 2023 launch.",
  "target_component": "model",
  "dsgai_mapping": ["DSGAI09", "DSGAI21"],
  "mitre_atlas_mapping": ["AML.T0068", "AML.T0051.001"],
  "owasp_llm_top10_mapping": ["LLM01:2025"],
  "attack_steps": [
    "Render the injection payload as text in an image — visible to the model's OCR, possibly imperceptible to a quick human glance.",
    "Place the image in a surface the VLM will ingest (user upload, document, web page, document with embedded image, EXIF preview).",
    "Submit; the VLM OCRs the image and acts on the embedded instructions."
  ],
  "prerequisites": [
    "Access to send images to the target VLM.",
    "Knowledge that the VLM ingests user-supplied images."
  ],
  "impact": [
    "policy_bypass",
    "data_exfiltration",
    "integrity_compromise"
  ],
  "detection_indicators": [
    "OCR output of user-supplied images containing imperative phrasing.",
    "Images containing text in low-contrast or background-blended regions.",
    "Mismatch between user-supplied text and the assistant's interpretation."
  ],
  "severity": {
    "qualitative": "High"
  },
  "source_urls": [
    "https://simonwillison.net/2023/Oct/14/multi-modal-prompt-injection/",
    "https://www.lakera.ai/blog/visual-prompt-injections"
  ],
  "date_documented": "2023-10-14",
  "date_added": "2026-05-18",
  "disclosure_status": "research_publication",
  "exploited_in_the_wild": "yes",
  "mitigations": [
    "OCR all user-supplied images and run the extracted text through the same injection-detection filters as raw text.",
    "Flag images containing imperative text or known injection patterns before passing to the VLM.",
    "Reject or sanitize inputs combining low-contrast text with sensitive query contexts."
  ],
  "related_vulnerabilities": [
    "DSGAI-VULN-2023-multimodal-image-prompt-injection"
  ],
  "tags": ["multimodal", "visual-prompt-injection", "vlm", "ocr-bypass"]
}
