{
  "$schema": "../schema.json",
  "exploit_id": "DSGAI-EXP-poisonedrag",
  "title": "PoisonedRAG — knowledge-corpus injection against retrieval-augmented LLMs",
  "description": "Zou et al. (arXiv 2402.07867) introduced PoisonedRAG, an optimization that crafts a small number of malicious passages (often 5 per target question) and injects them into a RAG corpus so that the LLM answers a chosen target question with the attacker-specified incorrect answer. The crafted passages are tuned to surface as top-k retrievals for the target query and to dominate the model's reasoning. The attack scales linearly: more target questions need only more passages, not corpus-wide compromise.",
  "target_component": "rag_pipeline",
  "dsgai_mapping": ["DSGAI04", "DSGAI21", "DSGAI13"],
  "mitre_atlas_mapping": ["AML.T0070", "AML.T0066"],
  "owasp_llm_top10_mapping": ["LLM04:2025"],
  "attack_steps": [
    "Specify target question(s) and the attacker's desired answer for each.",
    "Run the optimization to produce a small set of passages that (a) surface as top-k for the target query under the target embedding model, and (b) coerce the LLM into the attacker's answer.",
    "Insert the passages into a source the RAG ingests.",
    "When users ask the target question, the model returns the poisoned answer with high confidence."
  ],
  "prerequisites": [
    "Write access to a source the RAG ingests.",
    "Knowledge of the embedding model (or a similar surrogate)."
  ],
  "impact": [
    "integrity_compromise",
    "reputational_harm"
  ],
  "detection_indicators": [
    "Newly added passages whose embeddings are outliers relative to the corpus distribution.",
    "Documents whose content is tightly tuned to a specific high-traffic query pattern.",
    "Differential RAG output for the same query before and after a small set of doc additions."
  ],
  "severity": {
    "qualitative": "High"
  },
  "source_urls": [
    "https://arxiv.org/abs/2402.07867"
  ],
  "date_documented": "2024-02-12",
  "date_added": "2026-05-18",
  "disclosure_status": "research_publication",
  "exploited_in_the_wild": "suspected",
  "mitigations": [
    "Run embedding-outlier detection on newly ingested chunks.",
    "Require attestation/authentication on every source feeding the RAG; treat anonymous-author content as low-trust.",
    "Increase k for sensitive queries and compare top results for disagreement; flag conflicting evidence."
  ],
  "tags": ["rag-poisoning", "targeted-attack", "embedding-attack", "retrieval-manipulation"]
}
