{
  "$schema": "../schema.json",
  "exploit_id": "DSGAI-EXP-refusal-direction-abliteration",
  "title": "Refusal-direction abliteration — single-direction safety removal in open-weights models",
  "description": "Arditi et al. (arXiv 2406.11717) showed that refusal in chat-tuned LLMs is mediated by a single direction in residual-stream activation space. Subtracting that direction at inference time (or zeroing it during weight editing) produces an 'abliterated' variant of the model that complies with previously-refused requests while preserving general capability. The technique requires only white-box weight access and a small set of refused/accepted prompt pairs to identify the direction. Abliterated variants of popular open-weights models are now widely published on Hugging Face.",
  "target_component": "model",
  "dsgai_mapping": ["DSGAI20", "DSGAI21"],
  "mitre_atlas_mapping": ["AML.T0054", "AML.T0044"],
  "owasp_llm_top10_mapping": ["LLM03:2025"],
  "attack_steps": [
    "Acquire open-weights model and a small dataset of refused vs accepted prompts.",
    "Run activation analysis to identify the refusal direction in the residual stream.",
    "Subtract or zero the direction in the weights (or apply at inference time via a hook).",
    "Publish or distribute the abliterated model; downstream consumers inherit the safety removal."
  ],
  "prerequisites": [
    "White-box access to an open-weights model.",
    "Modest compute and a dataset of refused/accepted prompts."
  ],
  "impact": [
    "policy_bypass",
    "supply_chain_compromise",
    "reputational_harm"
  ],
  "detection_indicators": [
    "Newly published model variants tagged 'uncensored', 'abliterated', 'lobotomized'.",
    "Behavioral evals showing refusal-rate near zero with near-baseline capability.",
    "Downstream usage of these variants in production pipelines."
  ],
  "severity": {
    "qualitative": "High"
  },
  "source_urls": [
    "https://arxiv.org/abs/2406.11717",
    "https://huggingface.co/blog/mlabonne/abliteration"
  ],
  "date_documented": "2024-06-17",
  "date_added": "2026-05-18",
  "disclosure_status": "research_publication",
  "exploited_in_the_wild": "yes",
  "mitigations": [
    "Do not rely on alignment alone for open-weights deployments — assume any open model can be cheaply abliterated.",
    "Monitor downstream model usage for abliterated variants; block them at the registry/proxy layer.",
    "Apply system-level controls (input/output classifiers, tool-call confirmation) that survive a fully compliant model."
  ],
  "tags": ["weight-editing", "safety-removal", "open-weights-attack", "alignment-bypass"]
}
