{
  "$schema": "../schema.json",
  "exploit_id": "AML.T0019",
  "title": "Publish Poisoned Datasets",
  "description": "An adversary publishes a poisoned dataset to a public dataset hub (Hugging Face Datasets, Kaggle, GitHub, an academic mirror), either as a novel dataset designed to look attractive or as a poisoned variant of an existing open-source dataset. Downstream consumers who pick the dataset for fine-tuning, RAG indexing, or evaluation inherit the embedded backdoor. The technique is the public-distribution arm of Poison Training Data (AML.T0020).",
  "target_component": "training_pipeline",
  "dsgai_mapping": ["DSGAI04", "DSGAI07"],
  "mitre_atlas_mapping": ["AML.T0019", "AML.T0020"],
  "owasp_llm_top10_mapping": ["LLM03:2025", "LLM04:2025"],
  "attack_steps": [
    "Create a dataset with poisoned samples — either a novel set tuned to attract downstream use, or a typosquatted lookalike of a popular dataset.",
    "Publish to a public hub with metadata (description, license, citation hints) that mimics legitimate publishers.",
    "Promote via social channels, papers, or model cards that reference the dataset.",
    "Wait for downstream consumers to fine-tune or index with the poisoned set."
  ],
  "prerequisites": [
    "An account on a dataset hub.",
    "Optional: typosquatting capability against a popular dataset's name."
  ],
  "impact": [
    "supply_chain_compromise",
    "integrity_compromise"
  ],
  "detection_indicators": [
    "New high-popularity datasets from publishers with no prior history.",
    "Typosquatted dataset names.",
    "Dataset cards lacking provenance or attestation."
  ],
  "severity": {
    "qualitative": "High"
  },
  "source_urls": [
    "https://atlas.mitre.org/techniques/AML.T0019"
  ],
  "date_documented": "2022-10-21",
  "date_added": "2026-05-18",
  "disclosure_status": "atlas_catalog",
  "exploited_in_the_wild": "yes",
  "mitigations": [
    "Pin datasets to attested versions from known publishers; reject anonymous-author datasets for production fine-tuning.",
    "Maintain a curated internal dataset mirror with provenance verification.",
    "Apply integrity audits before any fine-tune; never train directly from public-pull at build time."
  ],
  "tags": ["dataset-poisoning", "supply-chain", "typosquatting"]
}
