{
  "$schema": "../schema.json",
  "exploit_id": "DSGAI-EXP-best-of-n-jailbreak",
  "title": "Best-of-N jailbreaking — augmented-sample brute force",
  "description": "Hughes et al. (Speechmatics/Haize Labs, arXiv 2412.03556) showed that simply re-asking a refused prompt many times with random surface-level perturbations (capitalization, typos, whitespace, sentence reordering, light paraphrasing) eventually elicits compliance on a large fraction of harmful prompts across modalities (text, image, audio). The technique requires no white-box access and no algorithmic optimization — just sampling. It scales with attempts as roughly N⁰·⁵ to N⁰·⁷⁵ success rate, making it cheap and reliable.",
  "target_component": "model",
  "dsgai_mapping": ["DSGAI21"],
  "mitre_atlas_mapping": ["AML.T0054"],
  "owasp_llm_top10_mapping": ["LLM01:2025"],
  "attack_steps": [
    "Generate N variants of the refused prompt via random surface-level perturbations.",
    "Submit each variant; collect non-refused responses.",
    "Score variants for compliance; iterate with successful patterns."
  ],
  "prerequisites": [
    "Query access at scale (paid or free-tier).",
    "Minimal compute."
  ],
  "impact": [
    "policy_bypass",
    "reputational_harm"
  ],
  "detection_indicators": [
    "Many semantically-similar but lexically-varying queries from a single account or coordinated key pool.",
    "Refusal-rate dropping over repeated near-duplicate queries within a session."
  ],
  "severity": {
    "qualitative": "High"
  },
  "source_urls": [
    "https://arxiv.org/abs/2412.03556"
  ],
  "date_documented": "2024-12-04",
  "date_added": "2026-05-18",
  "disclosure_status": "research_publication",
  "exploited_in_the_wild": "yes",
  "mitigations": [
    "Cluster near-duplicate refused queries per session; raise refusal stickiness after the first refusal.",
    "Rate-limit retries with semantic-similarity-aware throttling.",
    "Apply post-generation classifier (refusal-bypass detection) on outputs."
  ],
  "tags": ["jailbreak", "brute-force", "best-of-n", "multimodal"]
}
