{
  "$schema": "../schema.json",
  "exploit_id": "AML.T0070",
  "title": "RAG Poisoning",
  "description": "An adversary places content into a corpus indexed by a Retrieval-Augmented Generation system so that the content will later be retrieved and influence the model's response. The poisoned content may contain false facts, prompt injections, or false-RAG-entry payloads. Targeting is achieved by reverse-engineering the embedding model to write content whose vector lies near common query embeddings, by SEO-style keyword stuffing, or by indexing the content into a position likely to be retrieved.",
  "target_component": "rag_pipeline",
  "dsgai_mapping": ["DSGAI04", "DSGAI21", "DSGAI13"],
  "mitre_atlas_mapping": ["AML.T0070", "AML.T0066"],
  "owasp_llm_top10_mapping": ["LLM04:2025", "LLM02:2025"],
  "attack_steps": [
    "Reconnoiter the target RAG: identify the ingestion sources, embedding model, and retrieval ranking signals (AML.T0064).",
    "Craft content tuned to surface for the targeted queries (AML.T0066) — keyword tuning, embedding-space targeting, or pure injection payload.",
    "Deposit the content into a source the RAG ingests (a shared drive, ticket queue, monitored URL).",
    "Wait for the model to retrieve the poisoned passage; it then acts on the embedded instructions or relays the false facts to the user."
  ],
  "prerequisites": [
    "Write access — direct or indirect — to a source the RAG ingests."
  ],
  "impact": [
    "integrity_compromise",
    "data_exfiltration",
    "policy_bypass"
  ],
  "detection_indicators": [
    "New documents in the ingestion corpus with high keyword density or embedding outlier scores.",
    "Sudden retrieval-rank shifts for sensitive query patterns.",
    "Indexed content containing instruction-shaped phrasing."
  ],
  "severity": {
    "qualitative": "High"
  },
  "source_urls": [
    "https://atlas.mitre.org/techniques/AML.T0070",
    "https://arxiv.org/abs/2402.07867"
  ],
  "date_documented": "2024-12-01",
  "date_added": "2026-05-18",
  "disclosure_status": "atlas_catalog",
  "exploited_in_the_wild": "yes",
  "mitigations": [
    "Authenticate and authorize every source feeding the RAG; treat unvetted public sources as untrusted.",
    "Run integrity / injection-classification on ingested chunks before embedding.",
    "Tag retrieved content with provenance; require higher-trust provenance for sensitive answer generation.",
    "Monitor for embedding outliers and sudden corpus growth in a single source."
  ],
  "tags": ["rag-poisoning", "data-poisoning", "indirect-injection"]
}
