{
  "$schema": "../schema.json",
  "exploit_id": "AML.T0020",
  "title": "Poison Training Data",
  "description": "An adversary modifies the training data — feature values, labels, or both — used by an AI model in order to embed vulnerabilities, biases, or backdoors that the trained model exhibits at inference time. Poisoned data may be introduced via AI Supply Chain Compromise (AML.T0010) or after the adversary already has access to the training pipeline. Backdoors are typically activated by an Insert Backdoor Trigger (AML.T0043.004) sample at inference time, but untargeted poisoning to degrade overall integrity is also a documented variant.",
  "target_component": "training_pipeline",
  "dsgai_mapping": ["DSGAI04", "DSGAI21", "DSGAI05"],
  "mitre_atlas_mapping": ["AML.T0020", "AML.T0043.004"],
  "owasp_llm_top10_mapping": ["LLM04:2025"],
  "attack_steps": [
    "Gain access — either upstream via supply chain compromise or in-pipeline via Initial Access.",
    "Modify training samples or labels. For backdoors, introduce a small set of trigger-paired samples with the desired malicious label.",
    "Allow the model to train on the poisoned set.",
    "At inference time, present the trigger to activate the embedded behavior, or rely on the degraded baseline if untargeted."
  ],
  "prerequisites": [
    "Write access to training data (direct or upstream)."
  ],
  "impact": [
    "integrity_compromise",
    "policy_bypass",
    "supply_chain_compromise"
  ],
  "detection_indicators": [
    "Anomalous samples (statistical outliers, near-duplicates) in training corpora.",
    "Label-flip patterns inconsistent with annotator agreement.",
    "Model behavior inconsistencies on a held-out clean benchmark vs production traffic."
  ],
  "severity": {
    "qualitative": "Critical"
  },
  "source_urls": [
    "https://atlas.mitre.org/techniques/AML.T0020"
  ],
  "date_documented": "2022-10-21",
  "date_added": "2026-05-18",
  "disclosure_status": "atlas_catalog",
  "exploited_in_the_wild": "yes",
  "mitigations": [
    "Authenticate and version every dataset; require attestation for any externally-sourced data.",
    "Run dataset integrity checks (outlier detection, label-agreement audits) before each training run.",
    "Maintain a clean held-out benchmark and gate releases on its delta vs the production model."
  ],
  "tags": ["data-poisoning", "training-time-attack", "backdoor"]
}
