{
  "$schema": "../schema.json",
  "exploit_id": "AML.T0055",
  "title": "Unsecured Credentials (AI agent context)",
  "description": "An adversary searches AI-related systems for insecurely stored credentials — model-provider API keys in env files, agent-framework config in chatflow nodes, vector-store admin tokens in shared notebooks, OAuth refresh tokens in browser-assistant extensions. AI deployments have a notoriously broad credential surface (every integration is a secret), and frictionless-deployment culture often defaults to inline storage. A single found credential frequently unlocks the model-provider account, the embedding store, and several downstream SaaS integrations at once.",
  "target_component": "agent_framework",
  "dsgai_mapping": ["DSGAI02"],
  "mitre_atlas_mapping": ["AML.T0055"],
  "owasp_llm_top10_mapping": ["LLM06:2025"],
  "attack_steps": [
    "Reach the AI-deployment host or its repository (compromised dev box, leaked notebook, exposed Gradio share URL).",
    "Grep for credential patterns — *_api_key, OPENAI_API_KEY, Bearer tokens, connection strings.",
    "Test credentials against the relevant providers and integrations.",
    "Pivot through to dependent systems."
  ],
  "prerequisites": [
    "Read access to AI deployment configuration, env, notebooks, or shared filesystem."
  ],
  "impact": [
    "credential_exposure",
    "data_exfiltration",
    "financial_harm"
  ],
  "detection_indicators": [
    "Provider API usage from unfamiliar IPs.",
    "Sudden cost or quota spikes against AI-service keys.",
    "Secret-scanning hits on AI-project repositories."
  ],
  "severity": {
    "qualitative": "High"
  },
  "source_urls": [
    "https://atlas.mitre.org/techniques/AML.T0055"
  ],
  "date_documented": "2024-05-09",
  "date_added": "2026-05-18",
  "disclosure_status": "atlas_catalog",
  "exploited_in_the_wild": "yes",
  "mitigations": [
    "Centralized secrets management; ban inline credentials in chatflow nodes and notebooks.",
    "Scope per-integration keys to the minimum operations needed; rotate frequently.",
    "Secret-scanning in CI; alert on commits containing AI-provider credential patterns."
  ],
  "related_vulnerabilities": [
    "CVE-2024-1561",
    "CVE-2024-6825",
    "CVE-2024-5751"
  ],
  "tags": ["credential-theft", "secret-exposure", "agent-config"]
}
