{
  "$schema": "../schema.json",
  "exploit_id": "AML.T0093",
  "title": "Prompt Infiltration via Public-Facing Application",
  "description": "An adversary submits malicious prompts to a public-facing application — email inboxes, shared drives (OneDrive, Google Drive), ticket systems (Jira, ServiceNow), CRM, support portals — with the intent of having the content later ingested by an AI agent or RAG. The payload may sit dormant for days before triggering. This includes OCR-mediated infiltration where instructions are embedded in images, screenshots, or invoices that downstream OCR-driven AI pipelines consume.",
  "target_component": "agent_framework",
  "dsgai_mapping": ["DSGAI06", "DSGAI09", "DSGAI16"],
  "mitre_atlas_mapping": ["AML.T0093", "AML.T0051.001", "AML.T0051.002"],
  "owasp_llm_top10_mapping": ["LLM01:2025", "LLM02:2025"],
  "attack_steps": [
    "Reconnoiter the target organization for AI-monitored public-facing surfaces (AML.T0002).",
    "Compose payload that suits the eventual ingestion path — markdown for chat surfaces, OCR-readable text for image-bearing pipelines, structured fields for ticketing systems.",
    "Submit through legitimate channels — file a ticket, share a doc, send an invoice, post a Slack message.",
    "Wait for an authorized AI agent or RAG ingestion job to pull the payload into a privileged context."
  ],
  "prerequisites": [
    "Public submission path to any application the organization's AI agents observe.",
    "Optional knowledge of agent configuration (AML.T0084) to refine targeting."
  ],
  "impact": [
    "data_exfiltration",
    "policy_bypass",
    "integrity_compromise"
  ],
  "detection_indicators": [
    "External-origin content in public surfaces containing instruction-shaped phrasing.",
    "OCR output from images submitted via tickets/email that resembles directive prompts.",
    "Cross-correlation between new public submissions and immediate agent behavior change."
  ],
  "severity": {
    "qualitative": "High"
  },
  "source_urls": [
    "https://atlas.mitre.org/techniques/AML.T0093"
  ],
  "date_documented": "2025-04-09",
  "date_added": "2026-05-18",
  "disclosure_status": "atlas_catalog",
  "exploited_in_the_wild": "yes",
  "mitigations": [
    "Inventory every public submission surface and tag content origin downstream so AI agents can distinguish trust tiers.",
    "OCR all image-bearing submissions and scan extracted text through injection-detection filters.",
    "Do not give AI agents tool privileges over content that originated from public submissions until human review."
  ],
  "tags": ["public-application-injection", "persistence", "ocr-bypass"]
}
