{
  "$schema": "../schema.json",
  "exploit_id": "AML.T0069",
  "title": "Discover LLM System Information",
  "description": "An adversary probes the deployed LLM to learn about its system instructions, special characters with internal meaning, refusal trigger phrases, and tool/function names. Discovery may target the full system prompt (AML.T0069.002), the model's special character set including role delimiters (AML.T0069.000), or system-instruction keywords that indicate available functionality (AML.T0069.001). Recovered information is the input to LLM Prompt Crafting (AML.T0065) — the better the attacker maps the defenses, the more reliably the next injection will succeed.",
  "target_component": "model",
  "dsgai_mapping": ["DSGAI15", "DSGAI01"],
  "mitre_atlas_mapping": ["AML.T0069", "AML.T0069.000", "AML.T0069.001", "AML.T0069.002"],
  "owasp_llm_top10_mapping": ["LLM02:2025", "LLM07:2025"],
  "attack_steps": [
    "Issue baseline benign queries to map response style and refusal patterns.",
    "Test boundary probes — translate/repeat/encode-the-prompt requests, role-token enumeration, function-name fuzzing.",
    "Look for differential responses that leak system structure (special tokens echoed, function-shaped names refused at different rates).",
    "Combine clues to reconstruct the system prompt and configured tool surface."
  ],
  "prerequisites": [
    "Query access to the LLM."
  ],
  "impact": [
    "system_prompt_disclosure",
    "policy_bypass"
  ],
  "detection_indicators": [
    "User prompts containing role tokens, delimiter probes, or function-name fuzzing.",
    "High-volume prompt-extraction-shaped queries from a single session.",
    "Translate / repeat / encode-the-prompt requests at scale."
  ],
  "severity": {
    "qualitative": "Medium"
  },
  "source_urls": [
    "https://atlas.mitre.org/techniques/AML.T0069"
  ],
  "date_documented": "2024-12-01",
  "date_added": "2026-05-18",
  "disclosure_status": "atlas_catalog",
  "exploited_in_the_wild": "yes",
  "mitigations": [
    "Standardize refusal phrasing so behavior is consistent and not differentiable.",
    "Rate-limit per-session and detect reconnaissance-shaped prompt patterns.",
    "Do not echo system tokens or function names in error messages or refusals."
  ],
  "tags": ["reconnaissance", "system-prompt-discovery"]
}
